[
  {
    "id": "18pro",
    "name": "iPhone 18 Pro",
    "family": "Current",
    "display": "6.3″",
    "width": 402,
    "height": 874,
    "pixels": "1206 × 2622",
    "cutout": "compact",
    "radius": 62,
    "colors": [
      "#3c3c3c",
      "#f7f7f7",
      "#e8f2ff",
      "#4d1821"
    ],
    "colorNames": [
      "Black",
      "Silver",
      "Glacier",
      "Burgundy"
    ],
    "source": "https://www.apple.com/iphone-18-pro/specs/",
    "platform": "ios",
    "dpr": 3,
    "bezel": 16,
    "verifiedAt": "2026-10-30",
    "confidence": "official-body-buttons-cameras; measured-island-radius; estimated-insets",
    "notes": "Body, bezel, island, buttons and cameras from Apple's dimensional drawing; corner radius from the simulator. Safe insets estimated.",
    "safePortrait": {
      "top": 62,
      "right": 0,
      "bottom": 34,
      "left": 0
    },
    "safeLandscape": {
      "top": 0,
      "right": 62,
      "bottom": 20,
      "left": 62
    },
    "cutoutWidth": 94.5,
    "cutoutHeight": 36.67,
    "cutoutOffset": 14,
    "virtual": {
      "panel": "1206x2622@60:66x143",
      "variant": "d47vm2025vre",
      "source": "derived",
      "artworkSubtype": 2622,
      "cornerRadius": 62,
      "islandBottom": 153,
      "note": "Derived from Apple's iPhone 16 research variant: this model's display, artwork subtype and corner values; not Apple's own description."
    },
    "ppi": 460,
    "body": {
      "width": 71.85,
      "height": 150.01,
      "depth": 8.75,
      "radius": 12.71,
      "border": 1.44
    },
    "buttons": [
      {
        "kind": "action",
        "edge": "left",
        "from": 0.2055,
        "length": 0.046
      },
      {
        "kind": "volumeUp",
        "edge": "left",
        "from": 0.2855,
        "length": 0.0747
      },
      {
        "kind": "volumeDown",
        "edge": "left",
        "from": 0.3802,
        "length": 0.0747
      },
      {
        "kind": "side",
        "edge": "right",
        "from": 0.3112,
        "length": 0.118
      },
      {
        "kind": "cameraControl",
        "edge": "right",
        "from": 0.599,
        "length": 0.114
      }
    ],
    "back": {
      "parts": [
        {
          "kind": "plateau",
          "x": 0,
          "y": 0,
          "width": 71.85,
          "height": 48.4,
          "radius": 6
        },
        {
          "kind": "lens",
          "x": 6.08,
          "y": 5.53,
          "width": 16.58
        },
        {
          "kind": "lens",
          "x": 6.08,
          "y": 25.32,
          "width": 16.58
        },
        {
          "kind": "lens",
          "x": 24.2,
          "y": 15.7,
          "width": 16.58
        },
        {
          "kind": "flash",
          "x": 54.58,
          "y": 10.37,
          "width": 6.9
        },
        {
          "kind": "mic",
          "x": 57.45,
          "y": 23.41,
          "width": 1.15
        },
        {
          "kind": "lidar",
          "x": 54.58,
          "y": 30.71,
          "width": 6.9
        }
      ],
      "note": "Full-width camera plateau; lens, flash, microphone and LiDAR centres from Apple's dimensional drawing. Plateau height scaled off the drawing."
    },
    "provenance": {
      "body": "official: https://developer.apple.com/accessories/dimensional-drawings/ (iphone-18-pro.pdf): product 71.85 x 150.01 mm, active area 66.57 x 144.73 mm, 2.64 mm housing edge to active area, glass 69.45 x 147.61 mm (metal band 1.20 mm seen from the front)",
      "bodyRadius": "measured: Apple's continuous curve (tangent 1.5287 r) fitted to the corner profile, detail A, of https://developer.apple.com/accessories/dimensional-drawings/ (iphone-18-pro.pdf): tangent 19.43 mm; on the curve (13.90, 0.04), (8.46, 0.92), (3.80, 3.80); r = 12.71 mm",
      "cutout": "measured: island cutout 15.66/15.68 x 6.07 mm, centre 7.99/7.91 mm from the top edge in https://developer.apple.com/accessories/dimensional-drawings/, at 0.16565 mm per point",
      "radius": "measured: CoreSimulator DeviceCornerRadius 62 (iPhone19,2/19,3) https://github.com/damix00/expo-screen-corner-radius/pull/2",
      "safeArea": "estimated: as the 6.3-inch 2025 iPhones (17, 17 Pro); no published value for this model",
      "buttons": "official: button centres and lengths in https://developer.apple.com/accessories/dimensional-drawings/",
      "back": "official: https://developer.apple.com/accessories/dimensional-drawings/; plateau height estimated",
      "colors": "official names https://www.apple.com/iphone-18-pro/specs/; hex: Apple compare-page swatches https://www.apple.com/v/iphone/compare/an/built/styles/overview.built.css"
    },
    "designSource": "https://developer.apple.com/accessories/dimensional-drawings/"
  },
  {
    "id": "18promax",
    "name": "iPhone 18 Pro Max",
    "family": "Current",
    "display": "6.9″",
    "width": 440,
    "height": 956,
    "pixels": "1320 × 2868",
    "cutout": "compact",
    "radius": 62,
    "colors": [
      "#3c3c3c",
      "#f7f7f7",
      "#e8f2ff",
      "#4d1821"
    ],
    "colorNames": [
      "Black",
      "Silver",
      "Glacier",
      "Burgundy"
    ],
    "source": "https://www.apple.com/iphone-18-pro/specs/",
    "platform": "ios",
    "dpr": 3,
    "bezel": 16,
    "verifiedAt": "2026-10-30",
    "confidence": "official-body-buttons-cameras; measured-island-radius; estimated-insets",
    "notes": "Body, bezel, island, buttons and cameras from Apple's dimensional drawing; corner radius from the simulator. Safe insets estimated.",
    "safePortrait": {
      "top": 62,
      "right": 0,
      "bottom": 34,
      "left": 0
    },
    "safeLandscape": {
      "top": 0,
      "right": 62,
      "bottom": 20,
      "left": 62
    },
    "cutoutWidth": 94.67,
    "cutoutHeight": 36.67,
    "cutoutOffset": 14,
    "virtual": {
      "panel": "1320x2868@60:72x156",
      "variant": "d47vm2025vre",
      "source": "derived",
      "artworkSubtype": 2868,
      "cornerRadius": 62,
      "islandBottom": 153,
      "largeFormat": true,
      "note": "Derived from Apple's iPhone 16 research variant: this model's display, artwork subtype and corner values; not Apple's own description."
    },
    "ppi": 460,
    "body": {
      "width": 77.98,
      "height": 163.43,
      "depth": 8.75,
      "radius": 12.71,
      "border": 1.36
    },
    "buttons": [
      {
        "kind": "action",
        "edge": "left",
        "from": 0.1886,
        "length": 0.0422
      },
      {
        "kind": "volumeUp",
        "edge": "left",
        "from": 0.2621,
        "length": 0.0685
      },
      {
        "kind": "volumeDown",
        "edge": "left",
        "from": 0.349,
        "length": 0.0685
      },
      {
        "kind": "side",
        "edge": "right",
        "from": 0.2856,
        "length": 0.1083
      },
      {
        "kind": "cameraControl",
        "edge": "right",
        "from": 0.6319,
        "length": 0.1046
      }
    ],
    "back": {
      "parts": [
        {
          "kind": "plateau",
          "x": 0,
          "y": 0,
          "width": 77.98,
          "height": 48.4,
          "radius": 6
        },
        {
          "kind": "lens",
          "x": 6.08,
          "y": 5.53,
          "width": 16.58
        },
        {
          "kind": "lens",
          "x": 6.08,
          "y": 25.32,
          "width": 16.58
        },
        {
          "kind": "lens",
          "x": 24.2,
          "y": 15.7,
          "width": 16.58
        },
        {
          "kind": "flash",
          "x": 60.71,
          "y": 10.37,
          "width": 6.9
        },
        {
          "kind": "mic",
          "x": 63.58,
          "y": 23.41,
          "width": 1.15
        },
        {
          "kind": "lidar",
          "x": 60.71,
          "y": 30.71,
          "width": 6.9
        }
      ],
      "note": "Full-width camera plateau; lens, flash, microphone and LiDAR centres from Apple's dimensional drawing. Plateau height taken from the 18 Pro (not measured on this drawing)."
    },
    "provenance": {
      "body": "official: https://developer.apple.com/accessories/dimensional-drawings/ (iphone-18-pro-max.pdf): product 77.98 x 163.43 mm, active area 72.86 x 158.31 mm, 2.56 mm housing edge to active area, glass 75.58 x 161.03 mm (metal band 1.20 mm seen from the front)",
      "bodyRadius": "measured: Apple's continuous curve (tangent 1.5287 r) fitted to the corner profile, detail A, of https://developer.apple.com/accessories/dimensional-drawings/ (iphone-18-pro-max.pdf): tangent 19.43 mm; on the curve (13.90, 0.04), (8.46, 0.92), (3.80, 3.80); r = 12.71 mm",
      "cutout": "measured: island cutout 15.66/15.68 x 6.07 mm, centre 7.99/7.91 mm from the top edge in https://developer.apple.com/accessories/dimensional-drawings/, at 0.16565 mm per point",
      "radius": "measured: CoreSimulator DeviceCornerRadius 62 (iPhone19,2/19,3) https://github.com/damix00/expo-screen-corner-radius/pull/2",
      "safeArea": "estimated: as the 6.3-inch 2025 iPhones (17, 17 Pro); no published value for this model",
      "buttons": "official: button centres and lengths in https://developer.apple.com/accessories/dimensional-drawings/",
      "back": "official: https://developer.apple.com/accessories/dimensional-drawings/; plateau height estimated",
      "colors": "official names https://www.apple.com/iphone-18-pro/specs/; hex: Apple compare-page swatches https://www.apple.com/v/iphone/compare/an/built/styles/overview.built.css"
    },
    "designSource": "https://developer.apple.com/accessories/dimensional-drawings/"
  },
  {
    "id": "duo",
    "name": "iPhone Duo",
    "family": "Current",
    "display": "5.4″ / 7.6″",
    "width": 466,
    "height": 678,
    "openWidth": 951,
    "openHeight": 669,
    "pixels": "1398 × 2034",
    "openPixels": "2670 × 1878",
    "cutout": "punch",
    "radius": 59,
    "colors": [
      "#3c4042",
      "#fafafa"
    ],
    "colorNames": [
      "Night Sky",